{
  "evidence_id": "EVIDENCE-TASK-TODO-001",
  "task_id": "TASK-TODO-001",
  "agent": "implementation-agent",
  "timestamp": "2026-05-11T12:00:00Z",
  "changed_files": ["src/todo-store.js", "tests/todo-store.test.js"],
  "requirement_ids": ["REQ-TODO-001", "REQ-TODO-002", "REQ-TODO-003"],
  "acceptance_criteria_ids": ["AC-TODO-001", "AC-TODO-002", "AC-TODO-003", "AC-TODO-004"],
  "tests_added_or_modified": ["tests/todo-store.test.js"],
  "commands": [
    {
      "command": "node tests/todo-store.test.js",
      "raw_output_path": ".ai-state/test-history/TASK-TODO-001-test-output.txt",
      "exit_code": 0
    }
  ],
  "known_limitations": ["Example covers local store behavior only; no UI is included."],
  "human_approvals": []
}
